### ISSUE TITLE
Unable to send ARP/ICMP packet(in single mode)

### ISSUE THREAD

**Issue by starliiit** [pktgen/Pktgen-DPDK#7]
I'm trying to stress test another machine's routing performance (which is running a standard network stack, call it DUT)

## setup

So I set up 2 servers like this:

```
+------------------+
|                  |
|    pktgen-dpdk   |
|                  |
|  eth0      eth1  |
|    +         ^   |
+------------------+
     |         |
     |         |
+------------------+
|    |         |   |
|    v         +   |
|  enp1s0   enp2s0 |
|       DUT        |
|                  |
+------------------+
```

I want traffic to go like this:

```
eth0 ==> enp1s0 ==> enp2s0 ==> eth1
```

So I can measure the throughput and latency of DUT's routing system.

On the DUT machine I configured enp1s0 to `192.168.70.1` and enp2s0 to `192.168.80.1`.

In pktgen I entered these commands:

```
set 0 dst mac 0c:73:eb:90:2c:50 # MAC of enp1s0
set 1 dst mac 0c:73:eb:90:2c:51 # MAC of enp2s0

set 0 src ip 192.168.70.24/24
set 1 src ip 192.168.80.24/24

set 0 dst ip 192.168.80.24
set 1 dst ip 192.168.70.24
```

## problem

If I enter `start 0,1`, I can see both port 0 and port 1 are sending/receving packets. All is well.
But if I enter `start 0`, port 0 is sending packets as expected(1.4M pps), port 1 is only receiving 1 pps.
So I ran tcpdump on enp2s0, it shows that eth1 is not responding to ARP request sent by enp2s0.

```
root@dut:~# tcpdump -i enp2s0 -n
17:50:51.014623 ARP, Request who-has 192.168.80.24 tell 192.168.80.1, length 28
17:50:52.019744 ARP, Request who-has 192.168.80.24 tell 192.168.80.1, length 28
17:50:53.043704 ARP, Request who-has 192.168.80.24 tell 192.168.80.1, length 28
```

I tried `enable 0,1 process` and `enable 0,1 icmp` but with no sucess.
I added some logging statements in `pktgen_process_arp` function but it seems there's no problem in the logic.
I tried `ethtool -S enp2s0 | grep rx`, and confirmed no ARP response packet ever arrived to enp2s0.

I restarted pktgen, and entered the following command:

```
enable 0 icmp
enable 0 process
ping4 0
start arp 0 request
```

After `ping4 0` and `start arp 0 request` for a few times, I can see TX of port 0 is still 0. But in `page stats` I can see `opackets` and `obytes` field got updated correctly.
I think maybe that packets only entered the buffer but didn't get actually sent out? I don't know how to solve this, could you offer some help plz?

## environment

Some environment information:

- OS: ubuntu 18.04
- platform: x86_64
- pktgen-dpdk:20.02.0 (current master branch)
- DPDK: 19.11
- NIC: Intel Corporation I210 Gigabit Network Connection [8086:1533] (both machines)

This is a snapshot of pktgen console(if it helps):

```
| Ports 0-1 of 2   <Main Page>  Copyright (c) <2010-2019>, Intel Corporation
  Flags:Port        : PE-----Single      :0 P------Single      :1
Link State          :          <UP-1000-FD>          <UP-1000-FD>      ---Total Rate---
Pkts/s Max/Rx       :                   1/0                   1/0                   2/0
       Max/Tx       :                   0/0                   0/0                   0/0
MBits/s Rx/Tx       :                   0/0                   0/0                   0/0
Broadcast           :                     0                     0
Multicast           :                     0                     0
Sizes 64            :                     0                     0
      65-127        :                     2                     2
      128-255       :                     0                     0
      256-511       :                     0                     0
      512-1023      :                     0                     0
      1024-1518     :                     0                     0
Runts/Jumbos        :                   0/0                   0/0
ARP/ICMP Pkts       :                   0/0                   0/0
Errors Rx/Tx        :                   0/0                   0/0
Total Rx Pkts       :                     2                     2
      Tx Pkts       :                     0                     0
      Rx MBs        :                     0                     0
      Tx MBs        :                     0                     0
                    :
Pattern Type        :               abcd...               abcd...
Tx Count/% Rate     :         Forever /100%         Forever /100%
Pkt Size/Tx Burst   :             64 /   64             64 /   64
TTL/Port Src/Dest   :         4/ 1234/ 5678         4/ 1234/ 5678
Pkt Type:VLAN ID    :       IPv4 / TCP:0001       IPv4 / TCP:0001
802.1p CoS/DSCP/IPP :             0/  0/  0             0/  0/  0
VxLAN Flg/Grp/vid   :      0000/    0/    0      0000/    0/    0
IP  Destination     :           192.168.1.1           192.168.0.1
    Source          :        192.168.0.1/24        192.168.1.1/24
MAC Destination     :     0c:73:eb:92:0d:66     0c:73:eb:92:0d:65
    Source          :     0c:73:eb:92:0d:65     0c:73:eb:92:0d:66
PCI Vendor/Addr     :     8086:1533/06:00.0     8086:1533/07:00.0

-- Pktgen 20.02.0 (DPDK 19.11.1)  Powered by DPDK  (pid:9392) -----------------
```

**Comment by pktgen** [comment]
Inline comments.

**Comment by starliiit** [comment]
Sorry for the misleading snapshot above. When I wrote that I reopened a new pktgen console and immediately pasted the output without configuration just for showing some environment information.

I tried again and this is the correct snapshot.

```
\ Ports 0-1 of 2   <Main Page>  Copyright (c) <2010-2019>, Intel Corporation
  Flags:Port        : PE-I---Single      :0 P------Single      :1
Link State          :          <UP-1000-FD>          <UP-1000-FD>      ---Total Rate---
Pkts/s Max/Rx       :                   1/0                   1/0                   2/0
       Max/Tx       :                   0/0                   0/0                   0/0
MBits/s Rx/Tx       :                   0/0                   0/0                   0/0
Broadcast           :                     0                     0
Multicast           :                     0                     0
Sizes 64            :                     0                     0
      65-127        :                     2                     2
      128-255       :                     0                     0
      256-511       :                     0                     0
      512-1023      :                     0                     0
      1024-1518     :                     0                     0
Runts/Jumbos        :                   0/0                   0/0
ARP/ICMP Pkts       :                   0/0                   0/0
Errors Rx/Tx        :                   0/0                   0/0
Total Rx Pkts       :                     2                     2
      Tx Pkts       :                     0                     0
      Rx MBs        :                     0                     0
      Tx MBs        :                     0                     0
                    :
Pattern Type        :               abcd...               abcd...
Tx Count/% Rate     :         Forever /100%         Forever /100%
Pkt Size/Tx Burst   :             64 /   64             64 /   64
TTL/Port Src/Dest   :         4/ 1234/ 5678         4/ 1234/ 5678
Pkt Type:VLAN ID    :       IPv4 / TCP:0001       IPv4 / TCP:0001
802.1p CoS/DSCP/IPP :             0/  0/  0             0/  0/  0
VxLAN Flg/Grp/vid   :      0000/    0/    0      0000/    0/    0
IP  Destination     :         192.168.80.24         192.168.70.24
    Source          :      192.168.70.24/24      192.168.80.24/24
MAC Destination     :     0c:73:eb:90:2c:50     0c:73:eb:90:2c:51
    Source          :     0c:73:eb:92:0d:65     0c:73:eb:92:0d:66
PCI Vendor/Addr     :     8086:1533/06:00.0     8086:1533/07:00.0

-- Pktgen 20.02.0 (DPDK 19.11.1)  Powered by DPDK  (pid:22930) ----------------


Pktgen:/> set 0 dst mac 0c:73:eb:90:2c:50
Pktgen:/> set 1 dst mac 0c:73:eb:90:2c:51
Pktgen:/> set 0 src ip 192.168.70.24/24
Pktgen:/> set 1 src ip 192.168.80.24/24
Pktgen:/> set 0 dst ip 192.168.80.24
Pktgen:/> set 1 dst ip 192.168.70.24
Pktgen:/> enable 0 icmp
Pktgen:/> enable 0 process
Pktgen:/> ping4 0
Pktgen:/> start 0 arp request
Pktgen:/> ping4 0
```

btw: the 2 packets received by the each port seems irrelevant with my commands. They  appeared right after the ports are brought up, before I entered any command. 

tcpdump on enp2s0 shows these 2 packets:

```
09:37:54.519799 IP6 fe80::e73:ebff:fe90:2c51 > ff02::16: HBH ICMP6, multicast listener report v2, 1 group record(s), length 28
09:37:55.091800 IP6 fe80::e73:ebff:fe90:2c51 > ff02::16: HBH ICMP6, multicast listener report v2, 1 group record(s), length 28
```

Below is the output of `page stats`:

```
-                  <Real Port Stats Page>  Copyright (c) <2010-2019>, Intel Corporation

Port 0                        Pkts Rx/Tx      Rx Errors/Missed            Rate Rx/Tx           MAC Address
 0-06:00.0                           2/0                   0/0                   0/0     0C:73:EB:92:0D:65

                 ipackets       opackets         ibytes         obytes         errors
     Q  0:              2              3            180            180              0
     Q  1:              0              0              0              0              0
     Q  2:              0              0              0              0              0
     Q  3:              0              0              0              0              0
     Q  4:              0              0              0              0              0
     Q  5:              0              0              0              0              0
     Q  6:              0              0              0              0              0
     Q  7:              0              0              0              0              0
     Q  8:              0              0              0              0              0
     Q  9:              0              0              0              0              0
     Q 10:              0              0              0              0              0
     Q 11:              0              0              0              0              0
     Q 12:              0              0              0              0              0
     Q 13:              0              0              0              0              0
     Q 14:              0              0              0              0              0
     Q 15:              0              0              0              0              0
-- Pktgen 20.02.0 (DPDK 19.11.1)  Powered by DPDK  (pid:23934)
```

I tried `ping4 0` and `start 0 arp req` and `start 0 arp grat`. All these commands cause `opackets` increasing by 1 and obytes increasing by 60.

**Comment by pktgen** [comment]
Sorry, did not see this issue. The sending of ARP packets was broken and pktgen with the fix will be posted soon.

The place in the code you can change to make this work for now is around line 316 in file app/pktgen.c the while loop has a test that needs to be removed.

	/* Send all of the packets before we can exit this function */
	while (cnt && pktgen_tst_port_flags(info, SENDING_PACKETS)) {

	if (rnd)
		pktgen_rnd_bits_apply(info, pkts, cnt, NULL);

Change to:

	/* Send all of the packets before we can exit this function */
	while (cnt) {

	if (rnd)
		pktgen_rnd_bits_apply(info, pkts, cnt, NULL);

I hope this helps.

**Comment by starliiit** [comment]
Great, I'll give a try!
