### ISSUE TITLE
send multi src_ip failed(checksum error)

### ISSUE THREAD

**Issue by a1boyband** [pktgen/Pktgen-DPDK#84]
in the "rfc2544_tput_test.lua" , i wanted to send multi src_ips to testing my system

my change are as follows:

-- ip addresses to use
local dstip		= "1.1.1.20";
local srcip		= "1.1.1.1";
local netmask		= "/24";

local initialRate	= 100 ;

local function setupTraffic()
	pktgen.src_ip("0", "start", "1.1.1.1");
	pktgen.src_ip("0", "inc", "0.0.0.1");
	pktgen.src_ip("0", "min", "1.1.1.1");
	pktgen.src_ip("0", "max", "1.1.1.10");
	pktgen.dst_ip("1", "start", "1.1.1.20");
	pktgen.set_proto(sendport..","..recvport, "udp");
	-- set Pktgen to send continuous stream of traffic
	pktgen.set(sendport, "count", 0);
end

went i running this scrpit, on the system under test found that capture,src_ip is "192.168.0.1" and dst_ip is "192.168.1.1"

@pktgen ,how can fix it ?

**Comment by a1boyband** [comment]
I found a way to send more than one source IP.

in my script,i only range port 0,in fact the dstip is random too.

tcpdump:
17:38:56.340362 IP 1.1.1.5.chargen > 192.168.1.80.chargen: Flags [.], seq 0:6, ack 1, win 25760, length 6
17:38:56.340371 IP 1.1.1.4.cmip-man > 192.168.1.215.cmip-man: Flags [.], seq 305419896:305419902, ack 305419920, win 7236, length 6
17:38:56.340382 IP 1.1.1.8.at-7 > 192.168.1.5.at-7: Flags [.], seq 0:6, ack 1, win 17016, length 6
17:38:56.340391 IP 1.1.1.5.at-echo > 192.168.1.2.at-echo: Flags [.], seq 0:6, ack 1, win 7726, length 6
17:38:56.340401 IP 1.1.1.7.multiplex > 192.168.1.232.multiplex: Flags [.], seq 0:6, ack 1, win 8338, length 6
17:38:56.340411 IP 1.1.1.2.6 > 192.168.1.59.6: Flags [.], seq 0:6, ack 1, win 43661, length 6
17:38:56.340421 IP 1.1.1.7.genrad-mux > 192.168.1.230.genrad-mux: Flags [.], seq 0:6, ack 1, win 31315, length 6
17:38:56.340432 IP 1.1.1.5.irc > 192.168.1.248.irc: Flags [.], seq 0:6, ack 1, win 47744, length 6
17:38:56.340440 IP 1.1.1.9.3 > 192.168.1.58.3: Flags [.], seq 305419896:305419902, ack 305419920, win 29922, length 6
17:38:56.340449 IP 1.1.1.2.mpm-snd > 192.168.1.101.mpm-snd: Flags [.], seq 0:6, ack 1, win 6166, length 6

scrpit:
local function setupTraffic()
        pktgen.src_ip("0", "start", "1.1.1.1");
        pktgen.src_ip("0", "inc", "0.0.0.1");
        pktgen.src_ip("0", "min", "1.1.1.1");
        pktgen.src_ip("0", "max", "1.1.1.10");
        pktgen.set_range("0", "on");
        pktgen.dst_ip("1", "start", "1.1.1.20");
        pktgen.set_proto(sendport..","..recvport, "udp");
        -- set Pktgen to send continuous stream of traffic
        pktgen.set(sendport, "count", 0);
end

**Comment by a1boyband** [comment]
local function setupTraffic()
	pktgen.set_range("0", "on");
	pktgen.src_ip("0", "start", "1.1.1.1");
	pktgen.src_ip("0", "inc", "0.0.0.1");
	pktgen.src_ip("0", "min", "1.1.1.1");
	pktgen.src_ip("0", "max", "1.1.1.10");
	pktgen.src_port("0", "start", 5678);
	pktgen.src_port("0", "inc", 0);
	pktgen.src_port("0", "min", 5678);
	pktgen.src_port("0", "max", 5678);
	pktgen.dst_port("0", "start", 1234);
	pktgen.dst_port("0", "inc", 0);
	pktgen.dst_port("0", "min", 1234);
	pktgen.dst_port("0", "max", 1234);
	pktgen.dst_ip("0", "start", "1.1.1.20");
	pktgen.dst_ip("0", "inc", "0.0.0.0");
	pktgen.dst_ip("0", "min", "1.1.1.20");
	pktgen.dst_ip("0", "max", "1.1.1.20");
	pktgen.set_proto("0", "udp");
	pktgen.set_proto("all", "udp");
	-- set Pktgen to send continuous stream of traffic
	pktgen.set(sendport, "count", 0);
end

this script can limit dstip, dstport, srcport, but it can't limit protocol

when i running this script,Pktgen sends the TCP packets

**Comment by a1boyband** [comment]
this problem it look like #23, but how to fix it ?
@pktgen

**Comment by a1boyband** [comment]
i saw the readme.md 

find a way as follow:
 - 2.9.12  - Was not able to set IP protocol type for range packets.
             New command range.proto <portlist> udp|tcp|icmp
             Lua command is range_proto("all", "udp")

but, i insert this line(pkeget.range_proto("all", "udp") ;) in my script, i get the error as follow
Pktgen> !ERROR!: ./scripts/tput1.lua:50: attempt to call a nil value (field 'range_proto')
WARNING: *** Unable to find file (./scripts/tput1.lua) or invalid call

**Comment by pktgen** [comment]
> On Dec 13, 2016, at 3:44 AM, a1boyband <notifications@github.com> wrote:
> 
> i saw the readme.md
> 
> find a way as follow:
> 
> 	• 2.9.12 - Was not able to set IP protocol type for range packets.
> New command range.proto udp|tcp|icmp
> Lua command is range_proto("all", "udp")
> but, i insert this line(pkeget.range_proto("all", "udp") ;) in my script, i get the error as follow
> Pktgen> !ERROR!: ./scripts/tput1.lua:50: attempt to call a nil value (field 'range_proto')
> WARNING: *** Unable to find file (./scripts/tput1.lua) or invalid call

Sorry, I miss-typed the command in the readme it should be pktgen.ip_proto(“all”, “udp”);

> 
> —
> You are receiving this because you were mentioned.
> Reply to this email directly, view it on GitHub, or mute the thread.
> 

Keith Wiles
keith.wiles@icloud.com

**Comment by a1boyband** [comment]
@pktgen thank you, I found a way to read the cmd-functions.c file,

**Comment by a1boyband** [comment]
1.1.1.2.rrac > 1.1.1.20.search-agent: [bad udp cksum 0x1cd6 -> 0x7ae7!] UDP, length 18
06:44:12.344598 8c:dc:d4:a9:b5:3c (oui Unknown) > 8c:dc:d4:a9:b5:3d (oui Unknown), ethertype IPv4 (0x0800), length 60: (tos 0x0, ttl 4, id 11511, offset 0, flags [none], proto UD

checksum error @pktgen

**Comment by a1boyband** [comment]
can you hear me @pktgen

**Comment by pktgen** [comment]
> On Dec 13, 2016, at 4:44 PM, a1boyband <notifications@github.com> wrote:
> 
> 1.1.1.2.rrac > 1.1.1.20.search-agent: [bad udp cksum 0x1cd6 -> 0x7ae7!] UDP, length 18
> 
> 06:44:12.344598 8c:dc:d4:a9:b5:3c (oui Unknown) > 8c:dc:d4:a9:b5:3d (oui Unknown), ethertype IPv4 (0x0800), length 60: (tos 0x0, ttl 4, id 11511, offset 0, flags [none], proto UD

Which version of Pktgen are you using? Plus I just pushed a new version, have you tried that one yet?

> 
> checksum error @pktgen
> 
> —
> You are receiving this because you were mentioned.
> Reply to this email directly, view it on GitHub, or mute the thread.
> 

Keith Wiles
keith.wiles@icloud.com

**Comment by a1boyband** [comment]
@pktgen 

I tried using 3.0.7 and 3.1.0 versions, but there were problems

env:
dpdk-stable-16.07.2
centos7

**Comment by pktgen** [comment]
> On Dec 18, 2016, at 5:09 PM, a1boyband <notifications@github.com> wrote:
> 
> @pktgen
> 
> I tried using 3.0.7 and 3.1.0 versions, but there were problems

I do not know of any problem with 16.07 and Pktgen, can you please explain what the problems were?

> 
> env:
> dpdk-stable-16.07.2
> centos7
> 
> —
> You are receiving this because you were mentioned.
> Reply to this email directly, view it on GitHub, or mute the thread.
> 

Keith Wiles
keith.wiles@icloud.com
